營業地址,統一編號,總機構統一編號,營業人名稱,資本額,設立日期,組織別名稱,使用統一發票,行業代號,名稱,行業代號1,名稱1,行業代號2,名稱2,行業代號3,名稱3
"新北市新莊區中平里中和街１５５巷２４弄１２號",26702998,53717101,"意蕓國際股份有限公司附設溫莎公爵美語文理短期補習班",0,1000510,其他,Y,859511,課業輔導及補習教學,,,,,,
"新北市新莊區中平里中和街１５５巷２４弄１５號１０樓",42242156,,"鑲家居創意設計",2000000,1050415,合夥,Y,434011,室內裝潢工程,,,,,,
"新北市新莊區中平里中和街１５５巷２４弄１５號１０樓",82912820,,"鑲道投資管理顧問有限公司",1500000,1080625,有限公司,Y,669199,其他投資顧問,649914,創業投資公司,,,,
"新北市新莊區中平里中和街１５５巷２４弄１８號",82253713,,"匠魂串燒居酒屋",240000,1080220,獨資,Y,472999,未分類其他食品、飲料及菸草製品零售,561115,餐館、餐廳,472913,菸酒零售,,
"新北市新莊區中平里中和街１５５巷２４弄１９號１６樓",83108392,,"立正有限公司",1000000,1090819,有限公司,Y,464299,其他電子、通訊設備及其零組件批發,,,,,,
"新北市新莊區中平里中和街１５５巷２４弄１９號１６樓",83115062,,"遠邦文創有限公司",20000000,1090914,有限公司,N,903015,藝術表演活動籌辦、監製與經紀,,,,,,
"新北市新莊區中平里中和街１５５巷２４弄２０號１１樓",97375340,,"鑫達石材有限公司",2500000,0920903,有限公司,Y,461214,砂石批發,451099,其他商品批發經紀,,,,
"新北市新莊區中平里中和街１５５巷２４弄２１號",10586327,,"百秝洗衣坊",50000,0970403,獨資,N,961011,洗衣服務,,,,,,
"新北市新莊區中平里中和街１５５巷２４弄２５號",83202468,,"川堂豐開發有限公司",1000000,1100115,有限公司,Y,452000,綜合商品批發,,,,,,
"新北市新莊區中平里中和街１５５巷２４弄２７號",91210639,,"大發三明治商行",200000,1100810,獨資,N,561115,餐館、餐廳,,,,,,
"新北市新莊區中平里中和街１５５巷２４弄３２號",26547722,,"村秀養身美容室",200000,1000519,獨資,N,969011,美姿禮儀造型設計,,,,,,
"新北市新莊區中平里中和街１５５巷２４弄３３號",25075512,,"伊士歐室內裝修有限公司",1000000,0981125,有限公司,Y,434011,室內裝潢工程,,,,,,
"新北市新莊區中平里中和街１５５巷２４弄３７號５樓",02116647,,"李青芬工作室",100000,1030224,獨資,N,487912,非店面零售代理,,,,,,
"新北市新莊區中平里中和街１５５巷２４弄３９號（１樓）",82300321,,"龍火鮮烘咖啡豆社",200000,1080121,獨資,N,563112,咖啡館,,,,,,
"新北市新莊區中平里中和街１５５巷２４弄７號９樓",91120406,,"愛上網路有限公司",1000000,1100224,有限公司,Y,464111,電腦及電腦週邊設備批發,464112,電腦套裝軟體批發,,,,
"新北市新莊區中平里中和街１５５巷２４弄８號１５樓",26171295,,"謝明吉",5000,0981221,獨資,N,487113,經營網路購物,,,,,,
"新北市新莊區中平里中和街１５５巷２４弄８號６樓",31463960,,"久勝塑膠企業社",249000,0960206,獨資,Y,461915,塑膠、橡膠建材製品批發,,,,,,
"新北市新莊區中平里中和街１５５巷２４弄８９號３樓",83673093,,"檸聚有限公司",100000,1090716,有限公司,Y,487113,經營網路購物,455299,其他服裝及其配件批發,,,,
"新北市新莊區中平里中和街１５５巷２４弄９號８樓",85018564,,"中羿企業有限公司",500000,1080926,有限公司,Y,464913,消防設備批發,,,,,,
"新北市新莊區中平里中和街１５５巷２４弄９號８樓",87310404,,"純粹空間室內裝修行",100000,1090329,獨資,Y,434015,室內裝修工程,,,,,,
"新北市新莊區中平里中和街１５５巷２６號８樓",90692010,,"埕珈室內裝修設計有限公司",100000,1100407,有限公司,Y,434015,室內裝修工程,,,,,,
"新北市新莊區中平里中和街１５５巷２８號",73774115,,"宜美乾洗店",200000,0870401,獨資,N,961011,洗衣服務,,,,,,
"新北市新莊區中平里中和街１５５巷３２號",85145294,,"鑫宥企業社",200000,1080618,獨資,N,487113,經營網路購物,,,,,,
"新北市新莊區中平里中和街１５５巷３２號",87314154,,"慈聲生命禮儀社",200000,1090422,合夥,Y,963015,殯葬禮儀服務,,,,,,
"新北市新莊區中平里中和街１５５巷６號１樓",99431071,,"國安藥局",200000,0930211,獨資,Y,475112,西藥零售,474999,未分類其他家用器具及用品零售,,,,
"新北市新莊區中平里中和街１５５巷７號（１樓）",87308012,,"榮富優飲飲料店",100000,1090521,獨資,N,563111,冰果店、冷（熱）飲店,,,,,,
"新北市新莊區中平里中和街１５５巷８號",41126469,,"旺旺餃子館",100000,1030701,獨資,N,561113,麵店、小吃店,,,,,,
"新北市新莊區中平里中和街１５５巷８號４樓",16316743,,"伸囿有限公司",1000000,0870323,有限公司,Y,485214,紙盒、紙袋零售,,,,,,
"新北市新莊區中平里中和街１５５巷８號４樓",27478343,,"頂今企業有限公司",600000,0931109,有限公司,Y,462099,其他化學原材料及其製品批發,,,,,,
"新北市新莊區中平里中和街１５５巷８號６樓",23080130,,"歐凡有限公司",5000000,0771118,有限公司,Y,530100,普通倉儲經營,,,,,,
"新北市新莊區中平里中和街１５５巷８號６樓",26196325,,"加佳個人音樂工作室",130000,0990408,獨資,Y,902099,其他藝術表演,,,,,,
"新北市新莊區中平里中和街１５５巷８號６樓",27954090,,"泰準企業有限公司",500000,0941011,有限公司,Y,464499,其他辦公用機械器具批發,464211,電子器材、電子設備批發,,,,
"新北市新莊區中平里中和街１５５巷８號６樓",70598298,,"丹力國際有限公司",1000000,0890720,有限公司,Y,458299,其他運動用品及器材批發,487113,經營網路購物,,,,
"新北市新莊區中平里中和街１５７號１樓",91176885,52206117,"壹玖零陸國際股份有限公司新莊中和門市",0,1100330,股份有限公司,Y,563111,冰果店、冷（熱）飲店,,,,,,
"新北市新莊區中平里中和街１６１號",82313655,,"依嘉商行",150000,1080402,獨資,Y,563111,冰果店、冷（熱）飲店,,,,,,
"新北市新莊區中平里中和街１６３號",26743040,,"上成美容美髮院",200000,1001028,獨資,N,962111,美髮院及髮廊,,,,,,
"新北市新莊區中平里中和街１６５號（１樓）",85145288,,"竑勝茶行",200000,1080618,合夥,Y,563111,冰果店、冷（熱）飲店,,,,,,
"新北市新莊區中平里中和街１６７號",89723394,,"乙川企業有限公司",1000000,0841020,有限公司,Y,483212,手機及手機週邊零配件零售,820999,未分類其他行政支援服務,,,,
"新北市新莊區中平里中和街１６９號",34760985,,"福岡日式風味店",100000,0990618,獨資,N,561112,便當、自助餐店,,,,,,
"新北市新莊區中平里中和街１７１號",26526780,,"明源眼鏡行",100000,1000124,獨資,N,474412,眼鏡及其零配件零售,,,,,,
"新北市新莊區中平里中和街１７３號",21550233,,"向日葵造型沙龍",200000,0940425,獨資,N,962112,理髮店,,,,,,
"新北市新莊區中平里中和街１７５巷１３號１２樓",85169268,,"美特電子實業社",50000,1081004,獨資,Y,464211,電子器材、電子設備批發,,,,,,
"新北市新莊區中平里中和街１７５巷１９號１０樓",65168608,,"恆冰有限公司",100000,1050818,有限公司,Y,462099,其他化學原材料及其製品批發,,,,,,
"新北市新莊區中平里中和街１７５巷２號２樓之１",27986558,,"帝威國際物流有限公司",5000000,0950109,有限公司,Y,523300,航空貨運承攬,,,,,,
"新北市新莊區中平里中和街１７５巷２號２樓之１",30376849,,"帝威企業社",200000,0980423,獨資,Y,494099,其他汽車貨運,,,,,,
"新北市新莊區中平里中和街１７５巷２號２樓之１",87312677,,"願祥企業社",200000,1090413,獨資,Y,469912,宗教、喪葬用品批發,469916,礦物（寶石除外）批發,,,,
"新北市新莊區中平里中和街１７５巷３號",87318187,,"黎茵美甲美睫美學館",100000,1090506,獨資,N,962211,美甲美睫,,,,,,
"新北市新莊區中平里中和街１７５巷５號１樓",28504397,,"昱全清潔實業有限公司",900000,0951027,有限公司,Y,812100,建築物一般清潔服務,,,,,,
"新北市新莊區中平里中和街１７５巷６號",85178920,,"阿政鴨肉羹",100000,1081118,獨資,N,561113,麵店、小吃店,,,,,,
"新北市新莊區中平里中和街１７５巷７號",80638397,,"雯暄企業有限公司",2000000,0930206,有限公司,Y,455219,寵物服裝及其飾品配件批發,,,,,,
"新北市新莊區中平里中和街１７５巷８號１樓",82343692,,"瘋水煮便當店",10000,1080313,獨資,N,561113,麵店、小吃店,,,,,,
"新北市新莊區中平里中和街１７７號",09650074,,"三省小吃店",200000,0950410,獨資,N,561111,早餐店,,,,,,
"新北市新莊區中平里中和街１８３號",26504701,,"正大󿿆大王新莊幸福店",800000,0990916,獨資,N,561111,早餐店,,,,,,
"新北市新莊區中平里中和街１８５號（１樓）",83685274,,"品羿茶飲有限公司",1000000,1090723,有限公司,Y,563111,冰果店、冷（熱）飲店,,,,,,
"新北市新莊區中平里中和街１８７號５樓之１",09310081,,"有志企業社",200000,0950306,獨資,Y,820914,包裝承攬服務,524900,其他陸上運輸輔助,529099,未分類其他運輸輔助,,
"新北市新莊區中平里中和街１８９號",28393337,,"上博科技工程有限公司",1000000,0950919,有限公司,Y,433111,水電工程,434013,房屋設備安裝工程,,,,
"新北市新莊區中平里中和街１９１巷１﹒３﹒５號１樓",53649499,22555003,"統一超商股份有限公司新北市第一０一三分公司",0,1010426,本國公司設立之分公司,Y,471112,直營連鎖式便利商店,,,,,,
"新北市新莊區中平里中和街１９１巷１１號４樓",70675549,,"騰祥保潔消毒企業有限公司",5000000,0890210,有限公司,Y,812100,建築物一般清潔服務,381111,一般事業廢棄物清除,,,,
"新北市新莊區中平里中和街１９１巷１１號６樓",80253667,,"竺園景觀設計有限公司",2000000,0910926,有限公司,Y,432000,庭園景觀工程,,,,,,
"新北市新莊區中平里中和街１９１巷１５號６樓之１",30288711,,"捷達企業社",100000,0980820,獨資,Y,483111,電腦及電腦週邊設備零售,,,,,,
"新北市新莊區中平里中和街１９１巷１７號六樓之２",85135562,,"長星園藝社",200000,1080509,獨資,Y,453211,切花、盆栽批發,,,,,,
"新北市新莊區中平里中和街１９１巷４１號",08667294,,"淑惠早餐店",10000,0940714,獨資,N,561111,早餐店,,,,,,
"新北市新莊區中平里中和街１９１巷４３號４樓",83493563,,"樂群興有限公司",3000000,1081230,有限公司,Y,670012,不動產投資開發,,,,,,
"新北市新莊區中平里中和街１９１巷４５號５樓之２",54832781,,"錦瑤實業有限公司",3000000,1040415,有限公司,Y,252100,金屬結構製造,,,,,,
"新北市新莊區中平里中和街１９１巷７１號",37760066,,"龍富早餐店",200000,1010713,獨資,N,561115,餐館、餐廳,,,,,,
"新北市新莊區中平里中和街１９１巷９號２樓",01833396,,"興介企業社",200000,1020827,獨資,Y,464111,電腦及電腦週邊設備批發,,,,,,
"新北市新莊區中平里中和街１９１巷９號２樓",42832391,,"科騰數位科技有限公司",10500000,1041215,有限公司,Y,464299,其他電子、通訊設備及其零組件批發,483113,電子遊樂器、電子遊樂器套裝軟體零售,771312,電腦及其週邊設備出租,,
"新北市新莊區中平里中平路２４８號",87474285,,"大魔中平餐飲店",200000,1091118,合夥,Y,561115,餐館、餐廳,472999,未分類其他食品、飲料及菸草製品零售,472913,菸酒零售,,
"新北市新莊區中平里中平路２５６號",80683667,23928945,"安心食品服務股份有限公司新莊中平分公司",0,0930315,其他,Y,561114,連鎖速食店,,,,,,
"新北市新莊區中平里中平路２５６號８樓",85289377,,"謝侑庭",100000,1080903,獨資,Y,487113,經營網路購物,,,,,,
"新北市新莊區中平里中平路２５８號１４樓",87466601,,"幼安企業社",200000,1091021,獨資,N,456999,未分類其他家用器具及用品批發,475299,其他化粧品零售,471999,未分類其他綜合商品零售,,
"新北市新莊區中平里中平路２６０號之１（５樓）",10064951,,"詹玉龍",200000,0961031,獨資,N,487112,經營電視購物、電台購物,,,,,,
"新北市新莊區中平里中平路２６０號３樓",24709721,,"快樂遊租車有限公司",5000000,1031121,有限公司,Y,772100,汽車租賃,,,,,,
"新北市新莊區中平里中平路２６０號３樓",28196223,,"台灣小花汽車租賃有限公司",17000000,0950703,有限公司,Y,772100,汽車租賃,465111,全新汽車批發,484111,全新汽車零售,781099,其他人力仲介
"新北市新莊區中平里中平路２６０號３樓",54735211,,"台灣大花汽車租賃有限公司",8000000,1030722,有限公司,Y,772100,汽車租賃,465111,全新汽車批發,524100,停車場管理,465311,汽車零件、汽車百貨批發
"新北市新莊區中平里中平路２６２號",85274563,70771579,"亞太電信股份有限公司新莊中平門市",0,1080717,其他,Y,610112,有線通信服務,610212,無線通信服務,483111,電腦及電腦週邊設備零售,,
"新北市新莊區中平里中平路２６２號之１十六樓",85189102,,"敬華齋商行",100000,1080425,獨資,N,561113,麵店、小吃店,,,,,,
"新北市新莊區中平里中平路２６４號",31767204,22760834,"永慶房屋仲介股份有限公司中平榮富店",0,1010522,其他,Y,681211,不動產仲介,681212,不動產代銷,,,,
"新北市新莊區中平里中平路２６６號１２樓",90707061,,"呈奕有限公司",5000000,1100506,有限公司,Y,461999,未分類其他建材批發,433212,管道工程,,,,
"新北市新莊區中平里中平路２６８號４樓",54305417,,"聚星保全股份有限公司",40000000,1021023,股份有限公司,Y,800011,保全服務,,,,,,
"新北市新莊區中平里中平路２６８號４樓",54737338,,"聚星公寓大廈管理維護股份有限公司",20000000,1030731,股份有限公司,Y,782000,人力供應,812100,建築物一般清潔服務,,,,
"新北市新莊區中平里中平路２７０巷１號５樓",50987397,,"大紅影像製作有限公司",1500000,1080214,有限公司,Y,592014,廣播節目製作及發行,591312,電視節目代理及發行,731099,其他廣告服務,591113,電視節目製作
"新北市新莊區中平里中平路２７０巷１號９樓",80226352,,"世穎流行事業有限公司",500000,0910815,有限公司,Y,473211,服裝零售,474511,金（銀）飾零售,,,,
"新北市新莊區中平里中平路２７０巷１０弄１５號９樓",42833856,,"鑫鼎起重有限公司",1000000,1041221,有限公司,Y,439014,起重工程,820914,包裝承攬服務,781099,其他人力仲介,,
"新北市新莊區中平里中平路２７０巷１０弄１５號９樓",83630855,,"鑫濎起重有限公司",500000,1090518,有限公司,Y,529099,未分類其他運輸輔助,820914,包裝承攬服務,439014,起重工程,,
"新北市新莊區中平里中平路２７０巷１０弄２號之１七樓",16481953,,"緯霖國際有限公司",5000000,0870512,有限公司,Y,464111,電腦及電腦週邊設備批發,464999,未分類其他機械器具批發,464112,電腦套裝軟體批發,464913,消防設備批發
"新北市新莊區中平里中平路２７０巷１０弄２號之１七樓",83455842,,"祐霖有限公司",200000,1081225,有限公司,Y,464111,電腦及電腦週邊設備批發,639099,未分類其他資訊服務,631299,其他資料處理、主機及網站代管服務,464211,電子器材、電子設備批發
"新北市新莊區中平里中平路２７０巷１０弄２號之１十六樓",83633678,,"維峰國際管理顧問股份有限公司",500000,1090525,股份有限公司,N,639099,未分類其他資訊服務,702099,其他管理顧問服務,782000,人力供應,681112,不動產租賃
"新北市新莊區中平里中平路２７０巷１０弄２號４樓",85426061,,"好食飽寶企業社",200000,1090602,獨資,Y,454114,脫水蔬果批發,472999,未分類其他食品、飲料及菸草製品零售,454700,非酒精飲料批發,454999,未分類其他食品批發
"新北市新莊區中平里中平路２７０巷１３號１０樓",67123939,,"清月心靈有限公司",300000,1061005,有限公司,Y,452000,綜合商品批發,,,,,,
"新北市新莊區中平里中平路２７０巷１５號８樓",97490469,,"琨耀企業有限公司",1000000,0860430,有限公司,Y,464499,其他辦公用機械器具批發,,,,,,
"新北市新莊區中平里中平路２７０巷１６號３樓",54310312,,"喬愉國際有限公司",1000000,1021115,有限公司,Y,454999,未分類其他食品批發,464111,電腦及電腦週邊設備批發,471999,未分類其他綜合商品零售,487912,非店面零售代理
"新北市新莊區中平里中平路２７０巷１６號８樓",41403317,,"童話一六八知性手作坊",50000,1041001,獨資,N,474917,清潔用品零售,487912,非店面零售代理,,,,
"新北市新莊區中平里中平路２７０巷１６號８樓",83483474,,"科奧國際有限公司",200000,1090317,有限公司,Y,464111,電腦及電腦週邊設備批發,456199,其他家用電器批發,464299,其他電子、通訊設備及其零組件批發,,
"新北市新莊區中平里中平路２７０巷２號",69260825,,"來購有限公司",1000000,1070118,有限公司,Y,454999,未分類其他食品批發,454916,麵粉批發,461515,建材五金（螺絲、螺帽、鉚釘等金屬製品）批發,456999,未分類其他家用器具及用品批發
"新北市新莊區中平里中平路２７０巷２號１５樓",54850422,,"黑方國際有限公司",1500000,1040618,有限公司,Y,083019,豆類加工食品（豆腐、豆乾、豆皮、豆腐乳、豆豉、豆漿除外）製造,454999,未分類其他食品批發,,,,
"新北市新莊區中平里中平路２７０巷２１號",90839366,,"米吉有限公司",100000,1100208,有限公司,Y,456999,未分類其他家用器具及用品批發,456199,其他家用電器批發,458211,自行車及自行車零件批發,474999,未分類其他家用器具及用品零售
"新北市新莊區中平里中平路２７０巷２２號１１樓",90839865,,"燦成有限公司",50000,1100216,有限公司,N,487113,經營網路購物,,,,,,
"新北市新莊區中平里中平路２７０巷２３號１樓",82128265,,"帛玹自助洗衣店",100000,1070821,獨資,N,961012,自助洗衣店,,,,,,
"新北市新莊區中平里中平路２７０巷２５號１樓",30321628,,"摩綺髮藝",58000,0980304,獨資,N,962112,理髮店,,,,,,
"新北市新莊區中平里中平路２７０巷２５號３樓",91206810,,"陞裕國際企業社",236000,1100722,獨資,N,433111,水電工程,433112,電路工程,483299,其他通訊設備零售,,
"新北市新莊區中平里中平路２７０巷２５號６樓",83712764,,"翰方御品有限公司",1500000,1090414,有限公司,Y,454700,非酒精飲料批發,454811,茶葉批發,454999,未分類其他食品批發,456999,未分類其他家用器具及用品批發
"新北市新莊區中平里中平路２７０巷２７號",87323098,,"摸摸狗寵物美容工作室",100000,1090319,獨資,N,969021,寵物照顧及訓練,,,,,,
"新北市新莊區中平里中平路２７０巷３號５樓之２",87497180,,"洪洋工程行",100000,1100225,合夥,Y,434013,房屋設備安裝工程,434011,室內裝潢工程,434012,油漆粉刷、壁飾（紙）黏貼工程,,
"新北市新莊區中平里中平路２７０巷３１號（１樓）",50655313,,"佳鑫機車行",60000,1051221,獨資,N,959100,機車維修,,,,,,
"新北市新莊區中平里中平路２７０巷７弄１０號２樓",41086543,,"艾凱兒皂工坊",50000,1031119,獨資,N,474917,清潔用品零售,475299,其他化粧品零售,487113,經營網路購物,,
"新北市新莊區中平里中平路２７０巷７弄１０號２樓",47065833,,"康絜裝潢有限公司",150000,1050627,有限公司,N,434011,室內裝潢工程,,,,,,
"新北市新莊區中平里中平路２７０巷７弄１２號１５樓",90483597,,"文鑫電腦有限公司",1000000,1100901,有限公司,N,464111,電腦及電腦週邊設備批發,620900,其他電腦相關服務,,,,
"新北市新莊區中平里中平路２７０巷７弄１５號１樓",85269631,,"冠醫堂民俗調理養生館",100000,1080701,獨資,N,969015,按摩服務,,,,,,
"新北市新莊區中平里中平路２７０巷７弄１６號３樓",53863103,,"聖豐開發建設有限公司",15000000,1010612,有限公司,Y,433199,其他機電、電信及電路設備裝修,433900,其他建築設備安裝,670012,不動產投資開發,433212,管道工程
"新北市新莊區中平里中平路２７０巷７弄１８號２樓",85439729,,"中豐企業社",240000,1090721,獨資,N,465311,汽車零件、汽車百貨批發,465314,機車零件、機車百貨批發,484314,機車零件、機車百貨零售,458211,自行車及自行車零件批發
"新北市新莊區中平里中平路２７０巷７弄１９號２樓",83377327,,"納迪亞有限公司",100000,1100119,有限公司,Y,456999,未分類其他家用器具及用品批發,464112,電腦套裝軟體批發,456413,照相器材批發,702012,行銷管理顧問服務
"新北市新莊區中平里中平路２７０巷７弄２號３樓",85141924,,"大裕水產行",200000,1080603,獨資,Y,454399,其他水產品批發,,,,,,
"新北市新莊區中平里中平路２７０巷７弄２５號",09740060,,"慶聯金屬裝潢企業社",200000,0950718,獨資,N,252299,其他金屬建築組件製造,,,,,,
"新北市新莊區中平里中平路２７０巷７弄２７號８樓",78310396,,"億莊裝潢行",1000000,0820429,獨資,Y,434011,室內裝潢工程,192011,塗料製造,,,,
"新北市新莊區中平里中平路２７０巷７弄２９號（１樓）",85424269,,"珍宴瑤商行",240000,1090526,獨資,N,561115,餐館、餐廳,472914,飲料零售,,,,
"新北市新莊區中平里中平路２７０巷７弄３５號",50653259,,"維妮手作甜點工作室",200000,1051208,獨資,N,472922,西點麵包零售,487112,經營電視購物、電台購物,,,,
"新北市新莊區中平里中平路２７０巷７弄３６號４樓",83175791,,"亞歐電子有限公司",5000000,1090805,有限公司,Y,456199,其他家用電器批發,464111,電腦及電腦週邊設備批發,464211,電子器材、電子設備批發,,
"新北市新莊區中平里中平路２７０巷７弄４０號８樓",82891986,,"艾邇科技行銷有限公司",1000000,1080619,有限公司,Y,639099,未分類其他資訊服務,,,,,,
"新北市新莊區中平里中平路２７０巷７弄４２號８樓",53702769,,"凰宇企業有限公司",3000000,1010507,有限公司,Y,458111,文具批發,456799,其他清潔用品批發,456917,陶瓷器皿及餐具批發,454811,茶葉批發
"新北市新莊區中平里中平路２７０巷７弄４５號１樓",87465835,,"炘怡商行",100000,1091019,獨資,N,561113,麵店、小吃店,,,,,,
"新北市新莊區中平里中平路２７０巷７弄５４號",41406335,,"昕宸商行",100000,1041019,獨資,N,562099,其他外燴及團膳承包,,,,,,
"新北市新莊區中平里中平路２７０巷７弄５６號１樓",91349710,,"鄭師傅整復推拿",30000,1101004,獨資,N,869919,國術損傷接骨、國術推拿服務,969015,按摩服務,,,,
"新北市新莊區中平里中平路２７０巷７弄６號１１樓",82958629,,"特勤工程有限公司",200000,1080802,有限公司,Y,433117,電纜裝修工程,,,,,,
"新北市新莊區中平里中平路２７０巷７弄８號１０樓",82093913,,"金元鋁業工程行",200000,1070521,獨資,Y,461999,未分類其他建材批發,434013,房屋設備安裝工程,434012,油漆粉刷、壁飾（紙）黏貼工程,434015,室內裝修工程
"新北市新莊區中平里中平路２７０巷７弄８號１０樓",82303615,,"達亨水電行",200000,1080215,獨資,Y,433212,管道工程,474199,其他家用電器零售,434013,房屋設備安裝工程,434011,室內裝潢工程
"新北市新莊區中平里中平路２７０巷７弄８號１２樓",29001181,,"展盛企管顧問有限公司",1000000,0970806,有限公司,N,669199,其他投資顧問,455199,其他布疋批發,,,,
"新北市新莊區中平里中平路２７０巷７弄８號５樓",17519041,,"凱能工程行",600000,0881106,獨資,Y,434011,室內裝潢工程,192011,塗料製造,,,,
"新北市新莊區中平里中平路２７０巷７弄９號１０樓之２",54863398,,"陞陽國際有限公司",500000,1040818,有限公司,Y,731099,其他廣告服務,,,,,,
"新北市新莊區中平里中平路２７０巷９號３樓",54165582,,"快活人有限公司",1600000,1020219,有限公司,Y,474999,未分類其他家用器具及用品零售,,,,,,
"新北市新莊區中平里中平路２７４號",42706303,,"梅摩睿股份有限公司",5000000,1050125,股份有限公司,Y,089111,糕餅麵包製造,472922,西點麵包零售,,,,
"新北市新莊區中平里中平路２７４號３樓之１",50975596,,"元磊工程有限公司",2100000,1071204,有限公司,Y,434011,室內裝潢工程,740100,室內設計,,,,
"新北市新莊區中平里中平路２７４號７樓之２",83645920,,"康睿醫療器材有限公司",2000000,1090617,有限公司,Y,457199,其他藥品及醫療用品批發,475199,其他藥品及醫療用品零售,456799,其他清潔用品批發,,
