營業地址,統一編號,總機構統一編號,營業人名稱,資本額,設立日期,組織別名稱,使用統一發票,行業代號,名稱,行業代號1,名稱1,行業代號2,名稱2,行業代號3,名稱3
"新北市新莊區中宏里中誠街１７６號７樓",08722156,,"定鑫工程行",1000000,0940808,獨資,Y,433211,冷凍、通風、空調系統裝修工程,434013,房屋設備安裝工程,,,,
"新北市新莊區中宏里中誠街９４巷１０之３號（４樓）",72859662,,"統昱水電工程行",200000,1070202,獨資,Y,433111,水電工程,,,,,,
"新北市新莊區中宏里中誠街９４巷１４號１樓",89351773,,"啓盛電機有限公司",1000000,0840314,有限公司,Y,281099,其他發電、輸電及配電機械製造,,,,,,
"新北市新莊區中宏里中誠街９４巷１８號５樓",24695228,,"泰晟冷凍空調有限公司",5000000,1030916,有限公司,Y,433211,冷凍、通風、空調系統裝修工程,433115,消防警報系統裝修工程,433212,管道工程,,
"新北市新莊區中宏里中誠街９４巷３號１樓",98677630,,"美家清潔社",200000,0920501,獨資,Y,812100,建築物一般清潔服務,,,,,,
"新北市新莊區中宏里中誠街９６號３樓",83594204,,"盎格魯撒克遜有限公司",500000,1090707,有限公司,N,455999,未分類其他服飾品批發,,,,,,
"新北市新莊區中宏里幸福路７６５號",53724932,,"永聯不動產仲介經紀股份有限公司",3000000,1010822,股份有限公司,Y,681211,不動產仲介,859399,其他運動及休閒教育,,,,
"新北市新莊區中宏里幸福路７６７號（１樓）",83672854,,"郡陽企業有限公司",1000000,1090716,有限公司,Y,455111,絲織、麻織、棉織、毛織品批發,,,,,,
"新北市新莊區中宏里幸福路７６７號（１樓）",85427890,,"幸福滋滋茶坊",100000,1090608,合夥,Y,563111,冰果店、冷（熱）飲店,,,,,,
"新北市新莊區中宏里幸福路７６９號",10586473,27851279,"祿易通電信有限公司新莊中和門市部",0,0970409,其他,Y,464212,通訊傳播設備（電話、手機除外）批發,474114,通用電池零售,631299,其他資料處理、主機及網站代管服務,,
"新北市新莊區中宏里幸福路７６９號",90483962,,"出奇智勝有限公司",360000,1100902,有限公司,N,563111,冰果店、冷（熱）飲店,,,,,,
"新北市新莊區中宏里幸福路７６９號",91007100,,"金基國際有限公司",1000000,1100804,有限公司,N,474999,未分類其他家用器具及用品零售,454811,茶葉批發,472999,未分類其他食品、飲料及菸草製品零售,,
"新北市新莊區中宏里幸福路７７１號",02386711,,"衣定幸福精品服飾",200000,1030317,獨資,N,473999,未分類其他服飾品零售,,,,,,
"新北市新莊區中宏里幸福路７７３號８樓",96857164,,"伸桓企業有限公司",1000000,0850201,有限公司,Y,461313,衛浴設備批發,434011,室內裝潢工程,,,,
"新北市新莊區中宏里幸福路７７５號",54713309,,"全球通百貨有限公司",500000,1030417,有限公司,Y,464214,手機及手機週邊零配件批發,,,,,,
"新北市新莊區中宏里幸福路７７９號１樓",09907188,,"大富翁彩券行",100000,0950821,獨資,N,920011,彩券銷售,,,,,,
"新北市新莊區中宏里幸福路７８１號",12923824,,"瑞杰國際有限公司",1500000,0901115,有限公司,Y,473999,未分類其他服飾品零售,473199,其他布疋零售,461516,建材五金（基本金屬）批發,,
"新北市新莊區中宏里幸福路７８１號",41087873,,"斯瑪瘋企業社",200000,1031126,獨資,Y,483212,手機及手機週邊零配件零售,483299,其他通訊設備零售,,,,
"新北市新莊區中宏里幸福路７８１號９樓",85012787,,"友福中興有限公司",5000000,1080830,有限公司,N,115999,未分類其他紡織品製造,,,,,,
"新北市新莊區中宏里幸福路７８３號",98783626,,"華興開鎖店",200000,0920624,獨資,N,959917,開鎖及配鎖,,,,,,
"新北市新莊區中宏里幸福路７８７號",27366446,,"松下淨化科技有限公司",66000000,0931006,有限公司,Y,451099,其他商品批發經紀,474999,未分類其他家用器具及用品零售,474919,家用濾水器、淨水器零售,,
"新北市新莊區中宏里幸福路７８９號",15766002,,"玖久企業社",200000,0911203,獨資,N,471999,未分類其他綜合商品零售,,,,,,
"新北市新莊區中宏里幸福路７９１號",72804816,,"撐起雨傘",150000,1061120,獨資,N,473916,雨衣、雨鞋零售,,,,,,
"新北市新莊區中宏里幸福路７９１號",83208879,85076070,"傳啟實業股份有限公司新莊幸福分公司",0,1100125,本國公司設立之分公司,Y,561115,餐館、餐廳,,,,,,
"新北市新莊區中宏里幸福路７９１號（１樓）",85331092,,"鼎翊膳坊",200000,1081223,獨資,Y,561115,餐館、餐廳,,,,,,
"新北市新莊區中富街１２２號（１樓）",66842051,,"德謙技研有限公司",1000000,1060829,有限公司,Y,465311,汽車零件、汽車百貨批發,,,,,,
"新北市新莊區中山路１段１０７號Ｂ１",09895991,,"壹Ａ商行",100000,0960731,獨資,N,820999,未分類其他行政支援服務,,,,,,
"新北市新莊區中山路１段１４６號",86994597,,"長鑫加油站有限公司",28000000,0821016,有限公司,N,482111,汽油零售,,,,,,
"新北市新莊區中山路１段４６１之８號",18460856,,"台灣家具行",200000,0891006,獨資,N,474211,國產家用家具零售,,,,,,
"新北市新莊區中山路３段１６５號",26112923,,"丹鳳停車場",50000,0980820,獨資,N,524100,停車場管理,,,,,,
"新北市新莊區中山路３段４０２號６樓",49935999,,"張文賢",50000,0941027,獨資,N,487112,經營電視購物、電台購物,,,,,,
"新北市新莊區中平路與中原路口",82340793,50910124,"棧車開發有限公司中平營業所（副都心段１小段４２８．４２８之１地號）",0,1080304,其他,Y,524100,停車場管理,,,,,,
"新北市新莊區中平路與榮華路２段交叉口",72635312,,"碧瑤中平停車場",50000,1060406,獨資,N,524100,停車場管理,,,,,,
"新北市新莊區中平路１０５號",17622777,,"珍閣小吃店",100000,0890110,獨資,N,561113,麵店、小吃店,,,,,,
"新北市新莊區中平路１０７號",83975301,,"一伽一紅茶店",20000,0871022,獨資,N,472914,飲料零售,,,,,,
"新北市新莊區中平路１１０巷１９號１２樓",87315338,,"摔甩手作工作室",30000,1090422,獨資,N,487113,經營網路購物,,,,,,
"新北市新莊區中平路１１０巷１９號７樓",20837288,,"天慧企業有限公司",900000,0730711,有限公司,Y,233300,水泥及混凝土製品製造,,,,,,
"新北市新莊區中平路１１０巷２１號８樓",85345595,,"牧實工作室",10000,1090304,獨資,N,487113,經營網路購物,,,,,,
"新北市新莊區中平路１１０巷３６號地下二樓",01816376,28912041,"宏達經營管理顧問有限公司中平停車場",0,1020826,其他,Y,524100,停車場管理,,,,,,
"新北市新莊區中平路１１１號３樓",16386297,,"欽富工程有限公司",5000000,0870221,有限公司,Y,434012,油漆粉刷、壁飾（紙）黏貼工程,,,,,,
"新北市新莊區中平路１１２號３樓",23577238,,"合立鋼鐵有限公司",12000000,0790307,有限公司,Y,259913,金屬軟管製造,,,,,,
"新北市新莊區中平路１１４號",36317636,,"杏琳葯局",30000,0740401,獨資,N,475112,西藥零售,,,,,,
"新北市新莊區中平路１１６號",98671045,,"台灣味蚵仔麵線店",100000,0920414,獨資,N,561113,麵店、小吃店,,,,,,
"新北市新莊區中平路１２０號１樓",80935050,,"宏陽蔘藥行",200000,0920321,獨資,N,475111,中藥零售,,,,,,
"新北市新莊區中平路１２５號",36275312,,"鴻坤商店",30000,0730925,獨資,N,472913,菸酒零售,474999,未分類其他家用器具及用品零售,,,,
"新北市新莊區中平路１３０號前",37992333,,"李佳勇",150000,1020522,獨資,N,561200,餐食攤販,,,,,,
"新北市新莊區中平路１３２巷１６號",27506235,,"大發冷凍空調工程有限公司",5000000,0931215,有限公司,Y,433211,冷凍、通風、空調系統裝修工程,,,,,,
"新北市新莊區中平路１３２巷３弄１０號１樓",16936602,,"佳基科技有限公司",5000000,0880608,有限公司,Y,464211,電子器材、電子設備批發,,,,,,
"新北市新莊區中平路１３２巷３弄４號３樓",27583268,,"俐輝工程有限公司",1000000,0931230,有限公司,Y,812100,建築物一般清潔服務,773099,其他個人及家庭用品租賃,439099,未分類其他專門營造,,
"新北市新莊區中平路１３３巷Ｂ１停車場",72828824,70369154,"俥亭停車事業股份有限公司新莊文藝營業所",0,1061214,其他,Y,524100,停車場管理,,,,,,
"新北市新莊區中平路１４２號",74948661,,"益祥蔘藥行",50000,0871008,獨資,N,475111,中藥零售,,,,,,
"新北市新莊區中平路１４４號１樓",20010553,,"達林攝影社",50000,0851204,獨資,Y,760112,相片沖洗,,,,,,
"新北市新莊區中平路１５０號",80103181,,"鎰銘電器有限公司",3000000,0911231,有限公司,Y,474112,家電（視聽設備及家用空調器具除外）零售,,,,,,
"新北市新莊區中平路１５２巷１２號",89208051,,"頡大有限公司",5000000,0830906,有限公司,Y,455915,縫紉用品批發,,,,,,
"新北市新莊區中平路１５２巷１３弄２０號",84605329,,"泉玉企業有限公司",5000000,0821115,有限公司,Y,241213,鑄鋼件鑄造,,,,,,
"新北市新莊區中平路１５２巷３８號５樓",89713826,,"觀長企業有限公司",5000000,0841011,有限公司,Y,456111,家電材料批發,,,,,,
"新北市新莊區中平路１５２巷４１號",16363956,,"東宏線材企業有限公司",5000000,0870121,有限公司,Y,269999,其他未分類電子零組件製造,283100,電線及電纜製造,,,,
"新北市新莊區中平路１５２巷４１號３樓",89359629,,"元竣實業有限公司",3000000,0840322,有限公司,Y,251199,其他金屬手工具製造,,,,,,
"新北市新莊區中平路１５２巷４６號",84179177,,"詣盈企業有限公司",1000000,0820219,有限公司,Y,261199,其他積體電路製造,,,,,,
"新北市新莊區中平路１５２巷４７弄５號",49954329,,"李惠君",50000,0941104,獨資,N,487112,經營電視購物、電台購物,,,,,,
"新北市新莊區中平路１５２巷４８號２樓",16196043,,"翔新汽車材料有限公司",1000000,0860814,有限公司,Y,484311,汽車零件、汽車百貨零售,,,,,,
"新北市新莊區中平路１５２巷５號１樓",23509577,,"成鎂有限公司",1000000,0781027,有限公司,Y,481014,居家修繕用品零售,,,,,,
"新北市新莊區中平路１５２巷５１號",23973547,,"科達精密工業有限公司",3000000,0800228,有限公司,Y,251199,其他金屬手工具製造,,,,,,
"新北市新莊區中平路１６２號２樓",12999458,,"一信事業股份有限公司",5000000,0901231,股份有限公司,Y,702099,其他管理顧問服務,,,,,,
"新北市新莊區中平路１８０號１２樓",85179358,,"米米葉企業社",100000,1081120,獨資,N,487113,經營網路購物,,,,,,
"新北市新莊區中平路１８０號１２樓",91084083,,"立禾生技有限公司",500000,1100723,有限公司,N,669199,其他投資顧問,,,,,,
"新北市新莊區中平路１８２號２樓",35914017,,"僑星建設股份有限公司",21500000,0670720,股份有限公司,Y,681111,不動產買賣,670012,不動產投資開發,681112,不動產租賃,,
"新北市新莊區中平路１８２號２樓",96867395,,"僑助建設股份有限公司",50000000,0850205,股份有限公司,Y,670012,不動產投資開發,681112,不動產租賃,,,,
"新北市新莊區中平路１８２號４樓",17620644,,"韓玉服飾行",200000,0881216,獨資,N,473211,服裝零售,,,,,,
"新北市新莊區中平路１８４巷１０弄１０號１樓",23728926,,"合企企業有限公司",5000000,0800815,有限公司,Y,462099,其他化學原材料及其製品批發,,,,,,
"新北市新莊區中平路１８４巷８之１號",84826792,,"于德廣告有限公司",800000,0830427,有限公司,Y,731011,廣告代理商,,,,,,
"新北市新莊區中平路１８６號",99149010,,"永食鍋貼水餃專賣店",50000,0921007,獨資,Y,561113,麵店、小吃店,,,,,,
"新北市新莊區中平路１９４號",90919184,,"勤立汽車百貨行",49000,0830902,獨資,N,484311,汽車零件、汽車百貨零售,,,,,,
"新北市新莊區中平路１９６號",90920561,,"自然風花苑",40000,0830929,獨資,N,485111,切花、盆栽零售,485113,花卉材料、園藝器具零售,,,,
"新北市新莊區中平路１９６號１樓",23970128,,"新昇電腦資訊有限公司",5000000,0800302,有限公司,Y,483111,電腦及電腦週邊設備零售,,,,,,
"新北市新莊區中平路１９８巷２７號",18078508,,"心心美髮屋",30000,0890627,獨資,N,962299,其他美容美體服務,,,,,,
"新北市新莊區中平路１９８巷２７號",76870111,,"詠塑起重工程行",48000,0791009,獨資,Y,433113,電梯、電扶梯、升降機裝修工程,,,,,,
"新北市新莊區中平路１９８巷３１號對面",82200245,70614918,"永權實業有限公司中誠停車場",0,1070730,其他,Y,524100,停車場管理,,,,,,
"新北市新莊區中平路１９８巷３１號對面",91146335,37962252,"中誠停車場幸福營業所",0,1100218,其他,N,681112,不動產租賃,524100,停車場管理,,,,
"新北市新莊區中平路２００號２樓",84674789,,"昱毅工程有限公司",5000000,0830302,有限公司,Y,771100,營造用機械設備租賃,433212,管道工程,,,,
"新北市新莊區中平路２５０號９樓",85286723,,"黃依筠企業社",100000,1080827,獨資,N,487113,經營網路購物,,,,,,
"新北市新莊區中平路２６巷２５號２樓",02245620,,"台聖企業社",45000,0820505,獨資,Y,241212,鑄鐵件鑄造,,,,,,
"新北市新莊區中平路２６巷３５號",20015213,,"六一藥局",30000,0851001,獨資,N,475112,西藥零售,,,,,,
"新北市新莊區中平路２６巷４０號",19529262,,"佳霖工程行",200000,0850430,獨資,Y,422016,天然氣總管及市區管線營建,,,,,,
"新北市新莊區中平路２６巷５９號",84672396,,"金太祥機電顧問有限公司",10000000,0830322,有限公司,Y,433212,管道工程,433117,電纜裝修工程,433115,消防警報系統裝修工程,,
"新北市新莊區中平路２６６號",84544914,,"山田樂器有限公司",2000000,0820908,有限公司,Y,458314,樂器批發,476314,樂器零售,,,,
"新北市新莊區中平路２６８號１樓",16437079,23060248,"全家便利商店股份有限公司新莊狀元分公司",0,0870206,本國公司設立之分公司,Y,471112,直營連鎖式便利商店,,,,,,
"新北市新莊區中平路２７０巷２１號１樓",70375682,,"億潗國際有限公司",1000000,0880625,有限公司,Y,456999,未分類其他家用器具及用品批發,,,,,,
"新北市新莊區中平路２７０巷３號",99308749,,"昶勝機車行",200000,0921029,獨資,N,959100,機車維修,484211,全新機車零售,484212,中古機車零售,,
"新北市新莊區中平路２７０巷７弄１５號４樓",41388765,,"香貝里手工餅乾坊",240000,1040715,獨資,N,487113,經營網路購物,,,,,,
"新北市新莊區中平路２７４號９樓之２",83979088,,"淨林工坊",200000,0871221,獨資,N,820912,文件打字、撰稿及速記等服務,,,,,,
"新北市新莊區中平路２８號１樓",78205583,,"幸運照相材料行",500000,0810825,獨資,Y,474921,家用攝影機零售,760111,照相館,731099,其他廣告服務,,
"新北市新莊區中平路２８８號之１０（３樓）",70623352,,"造昶工程有限公司",2000000,0880909,有限公司,Y,433111,水電工程,,,,,,
"新北市新莊區中平路２９４號１樓",70806134,23060248,"全家便利商店股份有限公司新莊中平分公司",0,0900426,本國公司設立之分公司,Y,471112,直營連鎖式便利商店,,,,,,
"新北市新莊區中平路３１號３樓",86527279,,"加力電機有限公司",1000000,0810103,有限公司,Y,464921,原動機批發,,,,,,
"新北市新莊區中平路３２號",18085022,,"豊棋洋煙酒店",200000,0891220,獨資,Y,472913,菸酒零售,,,,,,
"新北市新莊區中平路３５號",89332431,,"宏興工商管理顧問有限公司",1000000,0840328,有限公司,Y,692012,稅務代理人事務服務,702099,其他管理顧問服務,,,,
"新北市新莊區中平路３５４號",98788170,,"快樂屋早餐店",20000,0920623,獨資,N,561111,早餐店,,,,,,
"新北市新莊區中平路３６巷１２號２樓",70643060,,"智堅工程有限公司",5000000,0881015,有限公司,Y,434011,室內裝潢工程,461400,漆料及塗料批發,,,,
"新北市新莊區中平路３６巷１７號３樓",84641253,,"富尉泰機械有限公司",5000000,0830105,有限公司,Y,292999,其他未分類專用機械設備製造,464322,輸送機械批發,,,,
"新北市新莊區中平路３６巷２９號",80924981,,"源順發商行",6000,0920219,獨資,N,471999,未分類其他綜合商品零售,472913,菸酒零售,,,,
"新北市新莊區中平路３６巷２９號２樓",78883149,,"興旺工程行",200000,0821218,獨資,Y,434011,室內裝潢工程,429099,未分類其他土木工程,,,,
"新北市新莊區中平路３７５號（１樓）",25010722,,"萬商不動產有限公司",1000000,0980811,有限公司,Y,681211,不動產仲介,,,,,,
"新北市新莊區中平路３７７巷",31506222,,"百客達停車場",200000,1000720,獨資,Y,524100,停車場管理,,,,,,
"新北市新莊區中平路３７７巷１之３號１２樓",24706787,,"泉得塑膠有限公司",4000000,1031107,有限公司,Y,220111,塑膠皮、塑膠布製造,,,,,,
"新北市新莊區中平路３７７巷１７弄",31508447,,"富達停車場",50000,1000726,獨資,N,524100,停車場管理,,,,,,
"新北市新莊區中平路３７７巷４３號１２樓",41409213,,"迪克斯家飾企業社",200000,1041103,獨資,Y,487113,經營網路購物,,,,,,
"新北市新莊區中平路３８號",92864468,,"豪記小吃店",100000,0831029,獨資,N,561113,麵店、小吃店,,,,,,
"新北市新莊區中平路３８２號",30293073,,"向陽小吃店",220000,0980917,獨資,N,561113,麵店、小吃店,,,,,,
"新北市新莊區中平路３９２號５樓",30194480,,"蘇雅惠",1000,0980122,獨資,N,487112,經營電視購物、電台購物,,,,,,
"新北市新莊區中平路４６巷１８號２樓",86583784,,"皇春精密工業有限公司",3000000,0810327,有限公司,Y,251299,其他金屬模具製造,259999,其他未分類金屬製品製造,,,,
"新北市新莊區中平路４６巷２２號２樓",72687155,,"壹柒柒日式美髮沙龍",100000,1061123,獨資,N,962111,美髮院及髮廊,,,,,,
"新北市新莊區中平路４６巷２８號",35870849,,"宜順機車行",10000,0661015,獨資,N,959100,機車維修,,,,,,
"新北市新莊區中平路４６巷６號",72687937,,"好食在商行",50000,1061128,獨資,N,561111,早餐店,,,,,,
"新北市新莊區中平路４６巷７號",02199359,,"泰新汽車材料行",49000,0781026,獨資,Y,465311,汽車零件、汽車百貨批發,484311,汽車零件、汽車百貨零售,,,,
"新北市新莊區中平路４８號",97488668,,"展鋒電器有限公司",1000000,0860428,有限公司,Y,474199,其他家用電器零售,,,,,,
"新北市新莊區中平路５２號",80225522,,"長昱開發股份有限公司",1000000,0910814,股份有限公司,Y,113000,不織布製造,,,,,,
"新北市新莊區中平路６巷口邊",37764372,,"家鄉的魯肉飯",50000,1010803,獨資,N,561200,餐食攤販,,,,,,
"新北市新莊區中平路６巷２７號１樓",34516245,,"扶元堂參葯行",10000,0720610,獨資,N,475111,中藥零售,,,,,,
"新北市新莊區中平路６巷３７號",36004439,,"蘇葯局",5000,0690512,獨資,N,475112,西藥零售,,,,,,
"新北市新莊區中平路６３號１樓",36028018,,"正光五金行",98000,0691020,獨資,Y,481014,居家修繕用品零售,,,,,,
"新北市新莊區中平路６６號１樓",70818315,23060248,"全家便利商店股份有限公司新莊中永分公司",0,0900924,本國公司設立之分公司,Y,471112,直營連鎖式便利商店,,,,,,
"新北市新莊區中平路７１巷２號",87759183,,"新翔乾洗店",50000,0830304,獨資,N,961011,洗衣服務,,,,,,
"新北市新莊區中平路７１巷４號",89571191,,"鉅超室內裝修工程有限公司",3000000,0840718,有限公司,Y,434011,室內裝潢工程,433212,管道工程,,,,
"新北市新莊區中平路７３號",78218200,,"法拉莉西點麵包坊",40000,0810507,獨資,N,472922,西點麵包零售,,,,,,
"新北市新莊區中平路７７號５樓",86113242,,"紘暉特殊鋼有限公司",1000000,0800502,有限公司,Y,461512,金屬結構及建築組件批發,,,,,,
"新北市新莊區中平路７８號騎樓",42010395,,"盧柏穎",100000,1040626,獨資,N,472914,飲料零售,,,,,,
"新北市新莊區中平路７９號前",39952786,,"紀明則",50000,1020527,獨資,N,561113,麵店、小吃店,,,,,,
"新北市新莊區中平路８巷１號",20468860,,"鈺花坊花藝設計室",50000,0860919,獨資,N,485111,切花、盆栽零售,485113,花卉材料、園藝器具零售,,,,
"新北市新莊區中平路８１巷２號",84451464,22555003,"統一超商股份有限公司台北縣第１６３分公司",0,0821120,本國公司設立之分公司,Y,474999,未分類其他家用器具及用品零售,,,,,,
"新北市新莊區中平路８１巷２０號９樓",91179503,,"芙吉工作室",30000,1100413,獨資,N,487113,經營網路購物,,,,,,
"新北市新莊區中平路８２巷１０號３樓",80468962,,"大祐科有限公司",1000000,0920901,有限公司,Y,464211,電子器材、電子設備批發,461515,建材五金（螺絲、螺帽、鉚釘等金屬製品）批發,,,,
"新北市新莊區中平路８２巷１６號１樓",36284136,,"正宗文具行",30000,0740104,獨資,N,476111,文具零售,,,,,,
"新北市新莊區中平路８２巷２號３樓",23484652,,"展業網版印刷有限公司",1000000,0780915,有限公司,Y,160211,製版,160100,印刷,,,,
"新北市新莊區中平路８２巷２７號６樓之３",85163790,,"豬曬皮編織工作室",20000,1080906,獨資,N,487113,經營網路購物,,,,,,
"新北市新莊區中平路８２巷２７號Ｂ１",85183058,28371994,"寶盛國際股份有限公司嘟嘟房中平全聯站",0,1080409,其他,Y,524100,停車場管理,,,,,,
"新北市新莊區中平路８２巷２８號",76881948,,"昇億機車行",200000,0800621,獨資,Y,465314,機車零件、機車百貨批發,484211,全新機車零售,,,,
"新北市新莊區中平路８２巷５號",98675437,,"中美高速洗車坊",100000,0920331,獨資,N,951200,汽車美容,,,,,,
"新北市新莊區中平路８２巷６號",98789163,,"鴻麒機車行",100000,0920710,獨資,N,484211,全新機車零售,959100,機車維修,,,,
"新北市新莊區中平路８５號１樓",86122761,03036306,"上海商業儲蓄銀行股份有限公司新莊分公司",0,0801126,本國公司設立之分公司,N,641211,本國銀行,,,,,,
"新北市新莊區中平路８７巷１號１樓",80022174,23224657,"台灣屈臣氏個人用品商店股份有限公司中平分公司",0,0920523,本國公司設立之分公司,Y,475299,其他化粧品零售,474999,未分類其他家用器具及用品零售,,,,
"新北市新莊區中平路９０巷巷口",39953096,,"丁玉龍",150000,1020527,獨資,N,561113,麵店、小吃店,,,,,,
"新北市新莊區中平路９２巷１號１樓１０８號１，２樓",16450614,69568009,"燦坤實業股份有限公司新莊分公司",0,0870618,本國公司設立之分公司,Y,474112,家電（視聽設備及家用空調器具除外）零售,,,,,,
"新北市新莊區中平里中和街１４７號（１樓）",85178203,,"佳喜小吃店",200000,1081114,獨資,N,561113,麵店、小吃店,,,,,,
"新北市新莊區中平里中和街１４７號８樓",54705785,,"台灣邁克電子股份有限公司",3000000,1030319,股份有限公司,Y,461516,建材五金（基本金屬）批發,456199,其他家用電器批發,,,,
"新北市新莊區中平里中和街１４７號８樓",83615046,,"股期人投顧有限公司",500000,1090427,有限公司,Y,669199,其他投資顧問,,,,,,
"新北市新莊區中平里中和街１５５巷１３號（１樓）",29107874,,"天元珊瑚有限公司",1000000,0970613,有限公司,Y,339112,珠寶及貴金屬飾物製造,474511,金（銀）飾零售,,,,
"新北市新莊區中平里中和街１５５巷１３號３樓",90444477,,"榮泰爾國際有限公司",600000,1101004,有限公司,N,465311,汽車零件、汽車百貨批發,456799,其他清潔用品批發,,,,
"新北市新莊區中平里中和街１５５巷１８號（１樓）",72873361,,"角落毛球寵物沐浴健行館",200000,1070417,獨資,N,485221,寵物用品零售,969021,寵物照顧及訓練,,,,
"新北市新莊區中平里中和街１５５巷２號",53014833,23060248,"全家便利商店股份有限公司新莊中環分公司",0,1000721,本國公司設立之分公司,Y,471112,直營連鎖式便利商店,,,,,,
"新北市新莊區中平里中和街１５５巷２號２樓",26577582,25180090,"穩嬴文教股份有限公司附設穩儒文理語文短期補習班",0,0991014,其他,N,859912,汽車駕駛訓練,,,,,,
"新北市新莊區中平里中和街１５５巷２０號",87505105,,"邱寶寶企業社",100000,1100323,獨資,N,561113,麵店、小吃店,,,,,,
"新北市新莊區中平里中和街１５５巷２０號（２樓）",82818424,,"傑瑞達商務服務有限公司",1000000,1080305,有限公司,Y,525913,船舶理貨,451099,其他商品批發經紀,529099,未分類其他運輸輔助,782000,人力供應
"新北市新莊區中平里中和街１５５巷２０號９樓",09827214,,"威禹工程行",300000,0960504,獨資,Y,433111,水電工程,,,,,,
