營業地址,統一編號,總機構統一編號,營業人名稱,資本額,設立日期,組織別名稱,使用統一發票,行業代號,名稱,行業代號1,名稱1,行業代號2,名稱2,行業代號3,名稱3
"新北市新莊區中和里１鄰復興路１段１２３―１號",29098137,,"晉興工程有限公司",1000000,0970529,有限公司,Y,422016,天然氣總管及市區管線營建,,,,,,
"新北市新莊區中和里１鄰復興路１段１３３之４號",12902567,,"梧桐木業有限公司",1000000,0900928,有限公司,Y,140999,未分類其他木竹製品製造,,,,,,
"新北市新莊區中和里１鄰復興路１段１３３號",22196295,,"至全實業有限公司",5000000,0750925,有限公司,Y,461112,竹材批發,,,,,,
"新北市新莊區中和里１鄰復興路１段１３９號",29156987,,"禾森房屋仲介有限公司",1750000,0990518,有限公司,Y,681211,不動產仲介,,,,,,
"新北市新莊區中和里１８鄰中和街１８號４樓",67801888,,"易聰企業社",200000,0870226,獨資,Y,472914,飲料零售,458111,文具批發,462012,塑膠原料批發,631299,其他資料處理、主機及網站代管服務
"新北市新莊區中和里１８鄰泰順街７５―１號",31448624,,"世恩商行",200000,0960119,獨資,Y,471113,加盟連鎖式便利商店,,,,,,
"新北市新莊區中和里２鄰中和街６號",76881644,,"千足電器行",40000,0800614,獨資,N,456111,家電材料批發,,,,,,
"新北市新莊區中和里２鄰復興路１段１０３號",09825784,,"永祥機車行",20000,0960502,獨資,N,465211,全新機車批發,484314,機車零件、機車百貨零售,476211,自行車及自行車零件零售,484316,機車輪胎零售
"新北市新莊區中和里２鄰復興路１段９３號",31402303,,"盛麻豆碗粿",50000,0951201,獨資,N,561111,早餐店,,,,,,
"新北市新莊區中和里２鄰復興路１段９７―２號",35192314,,"承展物流股份有限公司",25000000,0600101,股份有限公司,Y,494099,其他汽車貨運,530100,普通倉儲經營,484111,全新汽車零售,476299,其他運動用品及器材零售
"新北市新莊區中和里２鄰復興路１段９７―２號",86094054,,"承展起重工程有限公司",5000000,0800401,有限公司,Y,433113,電梯、電扶梯、升降機裝修工程,,,,,,
"新北市新莊區中和里２鄰復興路１段９７號",37879466,,"珍品餐飲坊",100000,1020409,獨資,N,561115,餐館、餐廳,,,,,,
"新北市新莊區中和里２鄰復興路１段９９號",97263627,,"優得露國際有限公司",5000000,0851115,有限公司,Y,454999,未分類其他食品批發,,,,,,
"新北市新莊區中和里８鄰中和街３０巷１１號",80700722,,"元大興室內裝修工程有限公司",2000000,0930220,有限公司,Y,434015,室內裝修工程,,,,,,
"新北市新莊區中和里８鄰中和街３８號１樓",31661194,,"食來也碳烤小吃店",300000,1010223,獨資,N,561111,早餐店,,,,,,
"新北市新莊區中和里８鄰中和街４０巷２號４樓",48738035,,"明聖企業社",1000000,0950331,獨資,Y,474511,金（銀）飾零售,473911,行李箱、旅行袋（箱）、背包、公事包、化箱零售,,,,
"新北市新莊區中和里８鄰中和街４０巷８號１樓",23522728,,"健凱企業有限公司",1000000,0810117,有限公司,Y,434013,房屋設備安裝工程,,,,,,
"新北市新莊區中和里８鄰中和街４０巷８號１樓",23940791,,"傑鈞企業有限公司",2000000,0801022,有限公司,Y,433111,水電工程,,,,,,
"新北市新莊區中央路和中平路交叉口",85272930,28858068,"台灣普客二四股份有限公司新莊中央中平停車場",0,1080711,其他,Y,524100,停車場管理,,,,,,
"新北市新莊區中央路昌平街口",87553773,85011099,"永錡停車場有限公司昌平停車場",0,1100114,其他,Y,524100,停車場管理,,,,,,
"新北市新莊區中央路與中貴路交叉路口",85274634,13062416,"萬應科技管理有限公司中貴停車場",0,1080717,本國公司設立之分公司,Y,524100,停車場管理,,,,,,
"新北市新莊區中央路與昌仁路交叉口",85183000,28912041,"宏達經營管理顧問有限公司昌仁停車場",0,1080409,其他,Y,524100,停車場管理,,,,,,
"新北市新莊區中央路與昌平街交叉口５０公尺處",41468922,54711267,"水花事業有限公司昌平停車場",0,1040331,其他,Y,524100,停車場管理,,,,,,
"新北市新莊區中央路與昌義路交叉口",37973602,35577078,"聯邦建設企業股份有限公司聯邦副都心站停車場",0,1020320,其他,Y,524100,停車場管理,,,,,,
"新北市新莊區中央路１３０號３樓",53333203,,"正崴投資股份有限公司",25000000,1000427,股份有限公司,N,649911,投資有價證券,,,,,,
"新北市新莊區中央路１９８號１６樓",65143608,,"旭睿科技股份有限公司",6000000,1050817,股份有限公司,Y,464211,電子器材、電子設備批發,,,,,,
"新北市新莊區中央路２０８號１６樓",56628790,,"明鑫智能有限公司",5000000,1060505,有限公司,Y,461515,建材五金（螺絲、螺帽、鉚釘等金屬製品）批發,,,,,,
"新北市新莊區中央路２１２號５樓",87478206,,"千層手作甜點店",100000,1091202,獨資,N,487113,經營網路購物,,,,,,
"新北市新莊區中央路２３０號１５樓",52904871,,"澐臻粧業國際有限公司",1000000,1060815,有限公司,Y,193099,其他清潔用品及化粧品製造,457299,其他化粧品批發,962299,其他美容美體服務,,
"新北市新莊區中央路２４６號６樓",66514162,,"申裕投資有限公司",20000000,1060315,有限公司,N,649911,投資有價證券,,,,,,
"新北市新莊區中央路２４６號６樓",70736171,,"永融科技有限公司",20000000,0890418,有限公司,Y,461515,建材五金（螺絲、螺帽、鉚釘等金屬製品）批發,464211,電子器材、電子設備批發,456199,其他家用電器批發,461516,建材五金（基本金屬）批發
"新北市新莊區中央路２８９號９樓",28463044,,"晉易科技股份有限公司",6600000,0960112,股份有限公司,Y,464211,電子器材、電子設備批發,,,,,,
"新北市新莊區中央路２９５號３樓",54712955,,"晨暘國際有限公司",5000000,1030416,有限公司,Y,781011,外籍勞工仲介,,,,,,
"新北市新莊區中央路４３７號旁",85420593,89483140,"岳洋股份有限公司新莊典華二站營業處",0,1090302,本國公司設立之分公司,Y,524100,停車場管理,,,,,,
"新北市新莊區中央路５７８號旁空地",82174197,42723133,"昌鑫停車場有限公司中央站",0,1070629,其他,Y,524100,停車場管理,,,,,,
"新北市新莊區中央路６９６號６樓",24385080,,"邑特傢俱有限公司",5000000,0980413,有限公司,Y,456211,國產家用家具批發,434011,室內裝潢工程,711112,景觀建築服務,681111,不動產買賣
"新北市新莊區中央路７００號８樓",52636762,,"明駿企業有限公司",3000000,1060413,有限公司,Y,273099,其他視聽電子產品製造,269999,其他未分類電子零組件製造,,,,
"新北市新莊區中央路７１０號３樓",91193060,,"盈灶餐飲工作室",30000,1100601,獨資,N,487113,經營網路購物,,,,,,
"新北市新莊區中央路７１２號２樓",16784675,,"皇加布業有限公司",50000000,0911028,有限公司,Y,455111,絲織、麻織、棉織、毛織品批發,,,,,,
"新北市新莊區中央路７３６號三樓之１",68116302,,"光洲國際開發有限公司",2000000,1061109,有限公司,Y,454700,非酒精飲料批發,457199,其他藥品及醫療用品批發,,,,
"新北市新莊區中央路７３６號１５樓之２",66630606,,"藝慧國際有限公司",2000000,1060707,有限公司,N,649911,投資有價證券,,,,,,
"新北市新莊區中央路７３６號１５樓之２",66655774,,"藏美國際企業有限公司",5000000,1060728,有限公司,Y,464499,其他辦公用機械器具批發,,,,,,
"新北市新莊區中央路７３６號８樓之１",25022086,,"群鋒投資有限公司",14800000,0980828,有限公司,N,649911,投資有價證券,,,,,,
"新北市新莊區中安街１０號３樓",18269274,,"玉鼎國藥舖",50000,0890831,獨資,N,475111,中藥零售,,,,,,
"新北市新莊區中安街２號",35194087,,"東海昌企業有限公司",2000000,0600501,有限公司,Y,482912,桶裝瓦斯零售,456211,國產家用家具批發,,,,
"新北市新莊區中安街２３號",89872669,,"紀耶企業有限公司",5000000,0831007,有限公司,Y,114099,其他染整,,,,,,
"新北市新莊區中安街３號７樓之１",22634204,,"捷鴻企業股份有限公司",50000000,0761001,股份有限公司,Y,474114,通用電池零售,,,,,,
"新北市新莊區中宏里中和街１１２號（１樓）",83123886,,"玉慶有限公司",200000,1090924,有限公司,Y,563111,冰果店、冷（熱）飲店,,,,,,
"新北市新莊區中宏里中和街１１３號８樓",83466539,,"振凱企業有限公司",6000000,1090121,有限公司,Y,456213,廚櫃批發,,,,,,
"新北市新莊區中宏里中和街１１４號",41078706,,"貞宜美甲室",100000,1031003,獨資,N,962211,美甲美睫,,,,,,
"新北市新莊區中宏里中和街１１４號（１樓）",82300997,,"云享小吃店",200000,1080124,獨資,N,561113,麵店、小吃店,,,,,,
"新北市新莊區中宏里中和街１１５號３樓",85142509,,"富鈞企業社",200000,1080606,獨資,Y,434011,室內裝潢工程,,,,,,
"新北市新莊區中宏里中和街１１７號（１樓）",83161488,,"泓睿數位有限公司",1000000,1091007,有限公司,Y,483212,手機及手機週邊零配件零售,487113,經營網路購物,,,,
"新北市新莊區中宏里中和街１１８之２號",85093394,,"美德利事業有限公司",100000,1080912,有限公司,Y,455211,服裝批發,,,,,,
"新北市新莊區中宏里中和街１１８號８樓",80039415,,"勝騰緩衝研發股份有限公司",1000000,0920421,股份有限公司,Y,220999,未分類其他塑膠製品製造,,,,,,
"新北市新莊區中宏里中和街１１９號",99457607,,"葉氏髮型造型店",200000,0930317,獨資,N,962111,美髮院及髮廊,,,,,,
"新北市新莊區中宏里中和街１２１號",34752991,,"衣著空間精品服飾店",100000,0990512,獨資,N,473211,服裝零售,473299,其他服裝及其配件零售,,,,
"新北市新莊區中宏里中和街１２１號５樓",22405716,,"羽民實業有限公司",5000000,0760326,有限公司,Y,251199,其他金屬手工具製造,,,,,,
"新北市新莊區中宏里中和街１２３號",85437285,,"宸璵商行",200000,1090714,合夥,Y,563111,冰果店、冷（熱）飲店,,,,,,
"新北市新莊區中宏里中和街１２３號（１樓）",85441443,,"友達烘焙坊",150000,1090728,獨資,N,472922,西點麵包零售,,,,,,
"新北市新莊區中宏里中和街１２３號９樓",72858137,,"芸榛小鋪",100000,1070129,獨資,N,487113,經營網路購物,,,,,,
"新北市新莊區中宏里中和街１２５巷１０弄１２號７樓",29132389,,"峰承工程有限公司",1000000,0990114,有限公司,Y,433111,水電工程,,,,,,
"新北市新莊區中宏里中和街１２５巷１１號７樓",70520905,,"德泰鋁業有限公司",1000000,0890601,有限公司,Y,252299,其他金屬建築組件製造,,,,,,
"新北市新莊區中宏里中和街１２５巷１４號",13379499,,"東育機車行",80000,0900308,獨資,N,484314,機車零件、機車百貨零售,,,,,,
"新北市新莊區中宏里中和街１２５巷１６號",50592248,,"石麗秋",200000,1050712,獨資,N,561113,麵店、小吃店,,,,,,
"新北市新莊區中宏里中和街１２５巷２號",82153593,,"淇藝美髮造型沙龍",150000,1080102,獨資,N,962111,美髮院及髮廊,,,,,,
"新北市新莊區中宏里中和街１２５巷２０號８樓",31112212,,"聯統塑膠有限公司",2700000,0680904,有限公司,Y,220999,未分類其他塑膠製品製造,,,,,,
"新北市新莊區中宏里中和街１２５巷２２號",02390089,,"復古家居家用品商行",100000,1030319,獨資,N,473999,未分類其他服飾品零售,474213,廚櫃零售,476111,文具零售,474399,其他家飾品零售
"新北市新莊區中宏里中和街１２５巷３號",87562652,,"奕辰小吃店",100000,1100201,獨資,N,561113,麵店、小吃店,,,,,,
"新北市新莊區中宏里中和街１２５巷６號１樓",30284102,,"酷寶貝寵物美容工作坊",50000,0980727,獨資,N,969021,寵物照顧及訓練,,,,,,
"新北市新莊區中宏里中和街１２５巷７號",66994107,,"鴻福養生館",200000,0950215,獨資,N,962299,其他美容美體服務,,,,,,
"新北市新莊區中宏里中和街１２７號１樓",30179170,,"慶翰商行",100000,0971226,獨資,Y,472914,飲料零售,,,,,,
"新北市新莊區中宏里中和街１３０號",31532143,,"健業藥妝藥局",60000,1000825,獨資,Y,475112,西藥零售,,,,,,
"新北市新莊區中宏里中和街１３１號（１樓）",91193619,,"吳懈可擊商行",200000,1100604,合夥,Y,563111,冰果店、冷（熱）飲店,,,,,,
"新北市新莊區中宏里中和街１３２號３樓",50968103,,"海馬展業有限公司",500000,1071024,有限公司,Y,461400,漆料及塗料批發,,,,,,
"新北市新莊區中宏里中和街５９巷１０弄２號",27866218,,"安聯寰宇有限公司",1000000,0940824,有限公司,N,620211,系統整合,702099,其他管理顧問服務,,,,
"新北市新莊區中宏里中和街５９巷１０弄２號",29365794,,"晴田機車材料行",100000,0940224,獨資,N,484314,機車零件、機車百貨零售,,,,,,
"新北市新莊區中宏里中和街５９巷１０弄２號５樓",85335793,,"岑欣商行",200000,1090110,獨資,Y,472914,飲料零售,,,,,,
"新北市新莊區中宏里中和街５９巷１０弄５號２樓",24702804,,"增新有限公司",1000000,1031021,有限公司,Y,461516,建材五金（基本金屬）批發,,,,,,
"新北市新莊區中宏里中和街５９巷１０弄５號２樓",70619505,,"元羿有限公司",5000000,0890811,有限公司,Y,254411,基本金屬表面處理,159913,塑膠模紙製造,,,,
"新北市新莊區中宏里中和街５９巷１０弄５號３樓",31704187,,"耀麒企業社",200000,1010918,獨資,Y,112999,未分類其他織布製造,,,,,,
"新北市新莊區中宏里中和街５９巷１０弄６號４樓",09958691,,"富揚服裝行",200000,0951013,獨資,Y,455211,服裝批發,,,,,,
"新北市新莊區中宏里中和街５９巷１０弄８號",29152835,,"禾興裝潢有限公司",500000,0990429,有限公司,Y,434011,室內裝潢工程,,,,,,
"新北市新莊區中宏里中和街５９巷１２號",37911590,34784380,"依平自助洗衣店中港店",0,1020918,獨資,N,961011,洗衣服務,474917,清潔用品零售,,,,
"新北市新莊區中宏里中和街５９巷１６號",26538998,,"髮兒時尚沙龍",100000,1000406,獨資,N,962111,美髮院及髮廊,,,,,,
"新北市新莊區中宏里中和街５９巷２號４樓",27671950,,"建信電子制品有限公司",500000,0940419,有限公司,Y,464211,電子器材、電子設備批發,461516,建材五金（基本金屬）批發,,,,
"新北市新莊區中宏里中和街５９巷２號４樓",29365507,,"鼎源企業社",450000,0940224,獨資,Y,812100,建築物一般清潔服務,434011,室內裝潢工程,434012,油漆粉刷、壁飾（紙）黏貼工程,456799,其他清潔用品批發
"新北市新莊區中宏里中和街５９巷２號５樓",15633778,,"佳翔企業社",230000,0911003,獨資,Y,812100,建築物一般清潔服務,,,,,,
"新北市新莊區中宏里中和街５９巷２０號４樓",82306654,,"晟利企業社",200000,1080305,獨資,Y,465311,汽車零件、汽車百貨批發,,,,,,
"新北市新莊區中宏里中和街５９巷２０號８樓",13788712,,"建宏室內設計工程行",200000,0900813,獨資,Y,434011,室內裝潢工程,,,,,,
"新北市新莊區中宏里中和街５９巷２２號",09959404,,"橘之夢小吃店",50000,0951013,獨資,N,561115,餐館、餐廳,,,,,,
"新北市新莊區中宏里中和街５９巷２４號６樓",54012186,,"昶龍企業有限公司",1000000,1010927,有限公司,Y,340015,電力機械器材及設備維修及安裝,,,,,,
"新北市新莊區中宏里中和街５９巷２６號１樓",49988545,,"衣城暄精品服飾行",200000,0941208,獨資,N,473911,行李箱、旅行袋（箱）、背包、公事包、化箱零售,,,,,,
"新北市新莊區中宏里中和街５９巷８號",49966486,,"銘峰企業社",200000,0941117,獨資,Y,782000,人力供應,,,,,,
"新北市新莊區中宏里中和街５９巷８號",82361656,,"銓恩實業社",200000,1080424,獨資,Y,471114,加盟連鎖式便利商店（無商品進、銷貨行為）,,,,,,
"新北市新莊區中宏里中和街５９巷８號",87531928,,"銘禮工作室",50000,1091124,獨資,N,487113,經營網路購物,,,,,,
"新北市新莊區中宏里中和街６１號",27932630,22555003,"統一超商股份有限公司台北縣第七一七分公司",0,0950221,本國公司設立之分公司,Y,471113,加盟連鎖式便利商店,,,,,,
"新北市新莊區中宏里中和街６３號",09942426,,"兆弘企業社",490000,0950921,獨資,Y,812100,建築物一般清潔服務,,,,,,
"新北市新莊區中宏里中和街６３號",16721778,,"煒鋒機械有限公司",1000000,0880105,有限公司,Y,293312,泵（幫浦）製造,,,,,,
"新北市新莊區中宏里中和街６３號３樓",27674387,,"傑瑛藝術文化事業有限公司",1200000,0940426,有限公司,Y,859999,其他未分類教育,,,,,,
"新北市新莊區中宏里中和街６９號",82311805,,"宮鋰沙龍",20000,1080408,獨資,N,962111,美髮院及髮廊,,,,,,
"新北市新莊區中宏里中和街７５號",53191491,,"興綻成工程有限公司",5000000,0991111,有限公司,Y,431015,基礎工程,429099,未分類其他土木工程,,,,
"新北市新莊區中宏里中和街７５號",96961716,,"濂承開發有限公司",5000000,0850607,有限公司,Y,439099,未分類其他專門營造,,,,,,
"新北市新莊區中宏里中和街７７號９樓",53683186,,"龍全工程有限公司",300000,1010209,有限公司,Y,429099,未分類其他土木工程,,,,,,
"新北市新莊區中宏里中和街７９號（１樓）",82148902,,"鋐運商行",100000,1071210,獨資,N,561115,餐館、餐廳,,,,,,
"新北市新莊區中宏里中和街８１號",26700963,,"貝爾多立藥局",100000,1000504,獨資,Y,475112,西藥零售,475111,中藥零售,,,,
"新北市新莊區中宏里中和街８１號",97024295,,"貝爾多立實業有限公司",5000000,0850705,有限公司,Y,475112,西藥零售,474917,清潔用品零售,,,,
"新北市新莊區中宏里中和街８１號６樓",66654233,,"駿鐽有限公司",500000,1060727,有限公司,Y,433115,消防警報系統裝修工程,,,,,,
"新北市新莊區中宏里中和街８３號",08650630,,"富吉銀樓",200000,0940704,獨資,Y,474511,金（銀）飾零售,,,,,,
"新北市新莊區中宏里中和街８７―１號４樓",27748515,,"欣技工程有限公司",3000000,0940725,有限公司,Y,433211,冷凍、通風、空調系統裝修工程,433212,管道工程,,,,
"新北市新莊區中宏里中和街８９號",87462128,,"芙欣商行",200000,1091005,獨資,N,561115,餐館、餐廳,,,,,,
"新北市新莊區中宏里中和街９１―１號２樓",70573178,,"福友租賃股份有限公司",1000000,0890701,股份有限公司,N,319014,航空器及其零件製造,681112,不動產租賃,,,,
"新北市新莊區中宏里中和街９１之１號",36036024,,"陽騰企業股份有限公司",5000000,0700109,股份有限公司,Y,259100,螺絲、螺帽及鉚釘製造,,,,,,
"新北市新莊區中宏里中和街９１之１號２樓",70573156,,"福企股份有限公司",1000000,0890701,股份有限公司,N,451099,其他商品批發經紀,465111,全新汽車批發,465311,汽車零件、汽車百貨批發,,
"新北市新莊區中宏里中和街９３號",09977141,,"護生動物醫院",3000,0951101,獨資,N,485221,寵物用品零售,,,,,,
"新北市新莊區中宏里中和街９５號",85425963,,"沁幸經典手搖飲專賣店",100000,1090601,獨資,N,563111,冰果店、冷（熱）飲店,,,,,,
"新北市新莊區中宏里中平路１５２巷３５號",36276895,,"億泰針車行",42000,0731011,獨資,Y,464313,紡織及成衣機械批發,,,,,,
"新北市新莊區中宏里中平路１５２巷４１號４樓",53425879,,"駿發金屬有限公司",1000000,1000727,有限公司,Y,461517,金屬手工具批發,,,,,,
"新北市新莊區中宏里中平路１５２巷４２號",36183974,,"棋坤企業有限公司",5000000,0770817,有限公司,Y,275111,聲納、雷達系統、遙感探測設備製造,451099,其他商品批發經紀,,,,
"新北市新莊區中宏里中平路１５２巷４２號",72330938,,"隆順汽車電機行",200000,1060602,獨資,Y,951199,其他汽車維修,484311,汽車零件、汽車百貨零售,465311,汽車零件、汽車百貨批發,464922,通用電池批發
"新北市新莊區中宏里中平路１５２巷４７弄１３號５樓",24440133,,"建民企業有限公司",500000,0980708,有限公司,Y,434012,油漆粉刷、壁飾（紙）黏貼工程,,,,,,
"新北市新莊區中宏里中平路１５２巷４７弄１８號７樓",85177345,,"原創文化設計工作室",100000,1081111,獨資,Y,740999,未分類其他專門設計服務,740100,室內設計,702099,其他管理顧問服務,434011,室內裝潢工程
"新北市新莊區中宏里中平路１５２巷４７弄２號１樓",09854400,,"上豪實業社",400000,0960608,獨資,Y,293511,電梯（升降機）、電扶梯製造,,,,,,
"新北市新莊區中宏里中平路１５２巷４７弄５號",49855355,,"菁樺商行",200000,0940824,合夥,Y,487211,單層直銷（有形商品）,,,,,,
"新北市新莊區中宏里中平路１５２巷５２號２樓",09614280,,"鼎瑞工程行",200000,0950307,獨資,Y,433111,水電工程,,,,,,
"新北市新莊區中宏里中誠街１０６巷１４－２號",69411632,,"燈全企業有限公司",100000,1070330,有限公司,Y,469199,其他回收物料批發,,,,,,
"新北市新莊區中宏里中誠街１０６巷４―１號",24274155,,"安科電子有限公司",500000,0971208,有限公司,Y,271999,未分類其他電腦週邊設備製造,464211,電子器材、電子設備批發,,,,
"新北市新莊區中宏里中誠街１０６巷５號（１樓）",54858851,,"銓品尚電子有限公司",200000,1040729,有限公司,Y,464299,其他電子、通訊設備及其零組件批發,,,,,,
"新北市新莊區中宏里中誠街１０６巷７號（１樓）",50998465,,"宜修有限公司",100000,1080408,有限公司,Y,434011,室內裝潢工程,,,,,,
"新北市新莊區中宏里中誠街１０６巷９之３號４樓",47985347,,"艾爾訊企業社",235000,1050930,獨資,Y,464211,電子器材、電子設備批發,464999,未分類其他機械器具批發,,,,
"新北市新莊區中宏里中誠街１１８巷７號",29100422,,"連晟有限公司",500000,0970605,有限公司,Y,439012,模板工程,,,,,,
"新北市新莊區中宏里中誠街１１８巷９―３號（４樓）",53420305,,"家齊工程有限公司",2000000,1000704,有限公司,Y,410013,住宅營建,461400,漆料及塗料批發,,,,
"新北市新莊區中宏里中誠街１２８之１號（２樓）",85343766,,"鴻綺商行",200000,1090226,獨資,Y,474999,未分類其他家用器具及用品零售,,,,,,
"新北市新莊區中宏里中誠街１３４號",02196389,,"富雄水電行",35000,0780530,獨資,N,481014,居家修繕用品零售,,,,,,
"新北市新莊區中宏里中誠街１３６號",09636524,,"宏棋玻璃行",360000,0950327,獨資,Y,461914,玻璃纖維建材製品批發,,,,,,
"新北市新莊區中宏里中誠街１４２巷１２―１號２樓",28358303,,"臣采有限公司",800000,0950720,有限公司,Y,465311,汽車零件、汽車百貨批發,465314,機車零件、機車百貨批發,,,,
"新北市新莊區中宏里中誠街１４２巷８號",54021328,,"威華創意有限公司",3200000,1011112,有限公司,Y,160100,印刷,731011,廣告代理商,,,,
"新北市新莊區中宏里中誠街１５４巷１２－３號４樓",49925893,,"美斯達興業社",200000,0941020,獨資,Y,434012,油漆粉刷、壁飾（紙）黏貼工程,,,,,,
"新北市新莊區中宏里中誠街１５６號１樓",08712050,,"慶大機車行",150000,0940801,獨資,N,959100,機車維修,484211,全新機車零售,484316,機車輪胎零售,,
"新北市新莊區中宏里中誠街１６６巷４號１樓",78310972,,"景亮室內裝潢工程行",5000000,0820520,獨資,Y,434011,室內裝潢工程,,,,,,
"新北市新莊區中宏里中誠街１６６巷６號（１樓）",82899143,,"曜慶工程有限公司",3000000,1080606,有限公司,Y,434011,室內裝潢工程,,,,,,
"新北市新莊區中宏里中誠街１７０號（１樓）",26515025,,"萬萬小吃店",230000,0991124,獨資,Y,561115,餐館、餐廳,472914,飲料零售,,,,
"新北市新莊區中宏里中誠街１７０號２樓",82849398,,"台灣厚德國際有限公司",10000,1080515,有限公司,N,462099,其他化學原材料及其製品批發,,,,,,
"新北市新莊區中宏里中誠街１７０號２樓",85159938,,"永緒企業社",200000,1080819,獨資,N,249100,其他基本金屬鑄造,,,,,,
"新北市新莊區中宏里中誠街１７０號２樓",85168970,,"凱旭工程行",200000,1081002,獨資,Y,433111,水電工程,,,,,,
"新北市新莊區中宏里中誠街１７０號２樓",85173559,,"天德宏新企業社",200000,1081022,獨資,Y,259999,其他未分類金屬製品製造,,,,,,
"新北市新莊區中宏里中誠街１７２號１樓",29044604,54164937,"三商家購股份有限公司新莊中誠分公司",0,0970725,本國公司設立之分公司,Y,471112,直營連鎖式便利商店,472913,菸酒零售,472999,未分類其他食品、飲料及菸草製品零售,471200,百貨公司
"新北市新莊區中宏里中誠街１７６號",72659073,,"醒暮早午餐店",180000,1060707,獨資,N,561111,早餐店,,,,,,
"新北市新莊區中宏里中誠街１７６號５樓",82361038,,"双胞胎批發",50000,1080403,獨資,N,487113,經營網路購物,,,,,,
